noc_code,type_english,name_english,type_french,name_french
22214,Exclusion(s),Airborne geophysical equipment operator  (See 22101 Geological and mineral technologists and technicians),Exclusion(s),Opérateur/opératrice de matériel géophysique aéroporté  (Voir 22101 Technologues et techniciens/techniciennes en géologie et en minéralogie)
22214,Exclusion(s),Drafting technologists and technicians  (See 22212 Drafting technologists and technicians),Exclusion(s),Technologues et techniciens/techniciennes en dessin  (Voir 22212 Technologues et techniciens/techniciennes en dessin)
22214,Exclusion(s),Geomatics engineer  (See 21300 Civil engineers),Exclusion(s),Ingénieur/ingénieure en géomatique  (Voir 21300 Ingénieurs civils/ingénieures civiles)
22214,Exclusion(s),Land survey technologists and technicians  (See 22213 Land survey technologists and technicians),Exclusion(s),Technologues et techniciens/techniciennes en arpentage  (Voir 22213 Technologues et techniciens/techniciennes en arpentage)
22214,Exclusion(s),Land surveyors  (See 21203 Land surveyors),Exclusion(s),Arpenteurs-géomètres/arpenteuses-géomètres  (Voir 21203 Arpenteurs-géomètres/arpenteuses-géomètres)
22214,Exclusion(s),Land use technician  (See 22300 Civil engineering technologists and technicians),Exclusion(s),Technicien/technicienne en utilisation des terres  (Voir 22300 Technologues et techniciens/techniciennes en génie civil)
22214,Exclusion(s),Meteorologists and climatologists  (See 21103 Meteorologists and climatologists),Exclusion(s),Météorologues et climatologues  (Voir 21103 Météorologues et climatologues)
22214,Exclusion(s),Surveying engineer  (See 21300 Civil engineers),Exclusion(s),Ingénieur arpenteur/ingénieure arpenteuse  (Voir 21300 Ingénieurs civils/ingénieures civiles)
22214,Exclusion(s),Urban planning technician  (See 22300 Civil engineering technologists and technicians),Exclusion(s),Technicien/technicienne en aménagement urbain  (Voir 22300 Technologues et techniciens/techniciennes en génie civil)
22220,Exclusion(s),"Advertising, marketing and public relations managers  (See 10022 Advertising, marketing and public relations managers)",Exclusion(s),"Directeurs/directrices de la publicité, du marketing et des relations publiques  (Voir 10022 Directeurs/directrices de la publicité, du marketing et des relations publiques)"
22220,Exclusion(s),Computer engineers (except software engineers and designers)  (See 21311 Computer engineers (except software engineers and designers)),Exclusion(s),Ingénieurs informaticiens/ingénieures informaticiennes (sauf ingénieurs/ingénieures et concepteurs/conceptrices en logiciel)  (Voir 21311 Ingénieurs informaticiens/ingénieures informaticiennes (sauf ingénieurs/ingénieures et concepteurs/conceptrices en logiciel))
22220,Exclusion(s),Computer systems developers and programmers  (See 21230 Computer systems developers and programmers),Exclusion(s),Développeurs/développeuses et programmeurs/programmeuses de systèmes informatiques  (Voir 21230 Développeurs/développeuses et programmeurs/programmeuses de systèmes informatiques)
22220,Exclusion(s),Information systems testing technicians  (See 22222 Information systems testing technicians),Exclusion(s),Évaluateurs/évaluatrices de systèmes informatiques  (Voir 22222 Évaluateurs/évaluatrices de systèmes informatiques)
22220,Exclusion(s),User support technicians  (See 22221 User support technicians),Exclusion(s),Agents/agentes de soutien aux utilisateurs  (Voir 22221 Agents/agentes de soutien aux utilisateurs)
22220,Exclusion(s),Web designers  (See 21233 Web designers),Exclusion(s),Concepteurs/conceptrices Web  (Voir 21233 Concepteurs/conceptrices Web)
22221,Exclusion(s),Computer network and web technicians  (See 22220 Computer network and web technicians),Exclusion(s),Techniciens/techniciennes de réseau informatique et Web  (Voir 22220 Techniciens/techniciennes de réseau informatique et Web)
22221,Exclusion(s),Computer systems developers and programmers  (See 21230 Computer systems developers and programmers),Exclusion(s),Développeurs/développeuses et programmeurs/programmeuses de systèmes informatiques  (Voir 21230 Développeurs/développeuses et programmeurs/programmeuses de systèmes informatiques)
22221,Exclusion(s),Cybersecurity specialists  (See 21220 Cybersecurity specialists),Exclusion(s),Spécialistes de la cybersécurité  (Voir 21220 Spécialistes de la cybersécurité)
22221,Exclusion(s),Information systems testing technicians  (See 22222 Information systems testing technicians),Exclusion(s),Évaluateurs/évaluatrices de systèmes informatiques  (Voir 22222 Évaluateurs/évaluatrices de systèmes informatiques)
22222,Exclusion(s),Business systems specialists  (See 21221 Business systems specialists),Exclusion(s),Spécialistes des systèmes commerciaux  (Voir 21221 Spécialistes des systèmes commerciaux)
22222,Exclusion(s),Computer engineers (except software engineers and designers)  (See 21311 Computer engineers (except software engineers and designers)),Exclusion(s),Ingénieurs informaticiens/ingénieures informaticiennes (sauf ingénieurs/ingénieures et concepteurs/conceptrices en logiciel)  (Voir 21311 Ingénieurs informaticiens/ingénieures informaticiennes (sauf ingénieurs/ingénieures et concepteurs/conceptrices en logiciel))
22222,Exclusion(s),Computer network and web technicians  (See 22220 Computer network and web technicians),Exclusion(s),Techniciens/techniciennes de réseau informatique et Web  (Voir 22220 Techniciens/techniciennes de réseau informatique et Web)
22222,Exclusion(s),Computer systems developers and programmers  (See 21230 Computer systems developers and programmers),Exclusion(s),Développeurs/développeuses et programmeurs/programmeuses de systèmes informatiques  (Voir 21230 Développeurs/développeuses et programmeurs/programmeuses de systèmes informatiques)
22222,Exclusion(s),Cybersecurity specialists  (See 21220 Cybersecurity specialists),Exclusion(s),Spécialistes de la cybersécurité  (Voir 21220 Spécialistes de la cybersécurité)
22222,Exclusion(s),Information systems specialists  (See 21222 Information systems specialists),Exclusion(s),Spécialistes en informatique  (Voir 21222 Spécialistes en informatique)
22222,Exclusion(s),Software developers and programmers  (See 21232 Software developers and programmers),Exclusion(s),Développeurs/développeuses et programmeurs/programmeuses de logiciels  (Voir 21232 Développeurs/développeuses et programmeurs/programmeuses de logiciels)
22222,Exclusion(s),Software engineers and designers  (See 21231 Software engineers and designers),Exclusion(s),Ingénieurs/ingénieures et concepteurs/conceptrices en logiciel  (Voir 21231 Ingénieurs/ingénieures et concepteurs/conceptrices en logiciel)
22222,Exclusion(s),User support technicians  (See 22221 User support technicians),Exclusion(s),Agents/agentes de soutien aux utilisateurs  (Voir 22221 Agents/agentes de soutien aux utilisateurs)
22222,Exclusion(s),Web designers  (See 21233 Web designers),Exclusion(s),Concepteurs/conceptrices Web  (Voir 21233 Concepteurs/conceptrices Web)
22222,Exclusion(s),Web developers and programmers  (See 21234 Web developers and programmers),Exclusion(s),Développeurs/développeuses et programmeurs/programmeuses Web  (Voir 21234 Développeurs/développeuses et programmeurs/programmeuses Web)
22230,Exclusion(s),Engineering inspectors and regulatory officers  (See 22231 Engineering inspectors and regulatory officers),Exclusion(s),Inspecteurs/inspectrices d'ingénierie et officiers/officières de réglementation  (Voir 22231 Inspecteurs/inspectrices d'ingénierie et officiers/officières de réglementation)
22230,Exclusion(s),Medical technologists and technicians  (See 3212 Medical technologists and technicians),Exclusion(s),Technologues et techniciens/techniciennes des sciences de la santé  (Voir 3212 Technologues et techniciens/techniciennes des sciences de la santé)
22231,Exclusion(s),Construction inspectors  (See 22233 Construction inspectors),Exclusion(s),Inspecteurs/inspectrices en construction  (Voir 22233 Inspecteurs/inspectrices en construction)
22231,Exclusion(s),Non-destructive testers and inspectors  (See 22230 Non-destructive testers and inspectors),Exclusion(s),Vérificateurs/vérificatrices et inspecteurs/inspectrices des essais non destructifs  (Voir 22230 Vérificateurs/vérificatrices et inspecteurs/inspectrices des essais non destructifs)
22231,Exclusion(s),Occupational health and safety specialists  (See 22232 Occupational health and safety specialists),Exclusion(s),Spécialistes de l'hygiène et de la sécurité au travail  (Voir 22232 Spécialistes de l'hygiène et de la sécurité au travail)
22231,Exclusion(s),Regulatory affairs officer  (See 11201 Professional occupations in business management consulting),Exclusion(s),Agent/agente des affaires réglementaires  (Voir 11201 Professionnels/professionnelles des services-conseils en gestion aux entreprises)
22231,Exclusion(s),Regulatory compliance officer  (See 11201 Professional occupations in business management consulting),Exclusion(s),Agent/agente de la conformité réglementaire  (Voir 11201 Professionnels/professionnelles des services-conseils en gestion aux entreprises)
22232,Exclusion(s),By-law enforcement and other regulatory officers  (See 43202 By-law enforcement and other regulatory officers),Exclusion(s),Agents/agentes d'application de règlements municipaux et autres agents/agentes de réglementation  (Voir 43202 Agents/agentes d'application de règlements municipaux et autres agents/agentes de réglementation)
22232,Exclusion(s),Construction inspectors  (See 22233 Construction inspectors),Exclusion(s),Inspecteurs/inspectrices en construction  (Voir 22233 Inspecteurs/inspectrices en construction)
22232,Exclusion(s),Engineering inspectors and regulatory officers  (See 22231 Engineering inspectors and regulatory officers),Exclusion(s),Inspecteurs/inspectrices d'ingénierie et officiers/officières de réglementation  (Voir 22231 Inspecteurs/inspectrices d'ingénierie et officiers/officières de réglementation)
22232,Exclusion(s),"Ergonomist  (See 41400 Natural and applied science policy researchers, consultants and program officers)",Exclusion(s),"Ergonome  (Voir 41400 Recherchistes, experts-conseils/expertes-conseils et agents/agentes de programmes, en sciences naturelles et appliquées)"
22232,Exclusion(s),"Occupational hygienist  (See 41400 Natural and applied science policy researchers, consultants and program officers)",Exclusion(s),"Hygiéniste du travail  (Voir 41400 Recherchistes, experts-conseils/expertes-conseils et agents/agentes de programmes, en sciences naturelles et appliquées)"
22232,Exclusion(s),Public and environmental health and safety professionals  (See 21120 Public and environmental health and safety professionals),Exclusion(s),Professionnels/professionnelles de la santé et sécurité publique et environnementale  (Voir 21120 Professionnels/professionnelles de la santé et sécurité publique et environnementale)
22233,Exclusion(s),By-law enforcement and other regulatory officers  (See 43202 By-law enforcement and other regulatory officers),Exclusion(s),Agents/agentes d'application de règlements municipaux et autres agents/agentes de réglementation  (Voir 43202 Agents/agentes d'application de règlements municipaux et autres agents/agentes de réglementation)
22233,Exclusion(s),Construction estimators  (See 22303 Construction estimators),Exclusion(s),Estimateurs/estimatrices en construction  (Voir 22303 Estimateurs/estimatrices en construction)
22233,Exclusion(s),Construction managers  (See 70010 Construction managers),Exclusion(s),Directeurs/directrices de la construction  (Voir 70010 Directeurs/directrices de la construction)
22233,Exclusion(s),Engineering inspectors and regulatory officers  (See 22231 Engineering inspectors and regulatory officers),Exclusion(s),Inspecteurs/inspectrices d'ingénierie et officiers/officières de réglementation  (Voir 22231 Inspecteurs/inspectrices d'ingénierie et officiers/officières de réglementation)
22233,Exclusion(s),Occupational health and safety specialists  (See 22232 Occupational health and safety specialists),Exclusion(s),Spécialistes de l'hygiène et de la sécurité au travail  (Voir 22232 Spécialistes de l'hygiène et de la sécurité au travail)
22300,Exclusion(s),Architectural technologists and technicians  (See 22210 Architectural technologists and technicians),Exclusion(s),Technologues et techniciens/techniciennes en architecture  (Voir 22210 Technologues et techniciens/techniciennes en architecture)
22300,Exclusion(s),Construction estimators  (See 22303 Construction estimators),Exclusion(s),Estimateurs/estimatrices en construction  (Voir 22303 Estimateurs/estimatrices en construction)
22300,Exclusion(s),Construction inspectors  (See 22233 Construction inspectors),Exclusion(s),Inspecteurs/inspectrices en construction  (Voir 22233 Inspecteurs/inspectrices en construction)
22300,Exclusion(s),Construction managers  (See 70010 Construction managers),Exclusion(s),Directeurs/directrices de la construction  (Voir 70010 Directeurs/directrices de la construction)
22300,Exclusion(s),Drafting technologists and technicians  (See 22212 Drafting technologists and technicians),Exclusion(s),Technologues et techniciens/techniciennes en dessin  (Voir 22212 Technologues et techniciens/techniciennes en dessin)
22300,Exclusion(s),Land survey technologists and technicians  (See 22213 Land survey technologists and technicians),Exclusion(s),Technologues et techniciens/techniciennes en arpentage  (Voir 22213 Technologues et techniciens/techniciennes en arpentage)
22300,Exclusion(s),Urban and land use planners  (See 21202 Urban and land use planners),Exclusion(s),Urbanistes et planificateurs/planificatrices de l'utilisation des sols  (Voir 21202 Urbanistes et planificateurs/planificatrices de l'utilisation des sols)
22301,Exclusion(s),Drafting technologists and technicians  (See 22212 Drafting technologists and technicians),Exclusion(s),Technologues et techniciens/techniciennes en dessin  (Voir 22212 Technologues et techniciens/techniciennes en dessin)
22301,Exclusion(s),Industrial designers  (See 22211 Industrial designers),Exclusion(s),Designers industriels/designers industrielles  (Voir 22211 Designers industriels/designers industrielles)
22301,Exclusion(s),Managers in manufacturing and utilities  (See 9001 Managers in manufacturing and utilities),Exclusion(s),Directeurs/directrices de la fabrication et des services d'utilité publique  (Voir 9001 Directeurs/directrices de la fabrication et des services d'utilité publique)
22301,Exclusion(s),Technical sales specialists - wholesale trade  (See 62100 Technical sales specialists - wholesale trade),Exclusion(s),Spécialistes des ventes techniques - commerce de gros  (Voir 62100 Spécialistes des ventes techniques - commerce de gros)
22302,Exclusion(s),Chemical processing quality control technician  (See 22100 Chemical technologists and technicians),Exclusion(s),Qualiticien spécialiste/qualiticienne spécialiste - traitement des produits chimiques  (Voir 22100 Technologues et techniciens/techniciennes en chimie)
22302,Exclusion(s),Chemical processing quality control technologist  (See 22100 Chemical technologists and technicians),Exclusion(s),Qualiticien/qualiticienne - traitement des produits chimiques  (Voir 22100 Technologues et techniciens/techniciennes en chimie)
22302,Exclusion(s),Food processing quality control technician  (See 22100 Chemical technologists and technicians),Exclusion(s),Qualiticien spécialiste/qualiticienne spécialiste - transformation des aliments  (Voir 22100 Technologues et techniciens/techniciennes en chimie)
22302,Exclusion(s),Food processing quality control technologist  (See 22100 Chemical technologists and technicians),Exclusion(s),Technologue de la couleur des textiles  (Voir 22100 Technologues et techniciens/techniciennes en chimie)
22302,Exclusion(s),"Machining, metal forming, shaping and erecting trades  (See 7210 Machining, metal forming, shaping and erecting trades)",Exclusion(s),"Personnel des métiers d'usinage, du formage, du profilage et du montage du métal  (Voir 7210 Personnel des métiers d'usinage, du formage, du profilage et du montage du métal)"
22302,Exclusion(s),Technical sales specialists - wholesale trade  (See 62100 Technical sales specialists - wholesale trade),Exclusion(s),Spécialistes des ventes techniques - commerce de gros  (Voir 62100 Spécialistes des ventes techniques - commerce de gros)
22302,Exclusion(s),Textile colour technologist  (See 22100 Chemical technologists and technicians),Exclusion(s),Qualiticien/qualiticienne - transformation des aliments  (Voir 22100 Technologues et techniciens/techniciennes en chimie)
22302,Exclusion(s),Textile dyeing technician  (See 22100 Chemical technologists and technicians),Exclusion(s),Technicien/technicienne en coloration de textiles  (Voir 22100 Technologues et techniciens/techniciennes en chimie)
22303,Exclusion(s),Architectural technologists and technicians  (See 22210 Architectural technologists and technicians),Exclusion(s),Technologues et techniciens/techniciennes en architecture  (Voir 22210 Technologues et techniciens/techniciennes en architecture)
22303,Exclusion(s),Civil engineering technologists and technicians  (See 22300 Civil engineering technologists and technicians),Exclusion(s),Technologues et techniciens/techniciennes en génie civil  (Voir 22300 Technologues et techniciens/techniciennes en génie civil)
22303,Exclusion(s),Civil engineers  (See 21300 Civil engineers),Exclusion(s),Ingénieurs civils/ingénieures civiles  (Voir 21300 Ingénieurs civils/ingénieures civiles)
22303,Exclusion(s),Construction managers  (See 70010 Construction managers),Exclusion(s),Directeurs/directrices de la construction  (Voir 70010 Directeurs/directrices de la construction)
22310,Exclusion(s),"Aircraft instrument, electrical and avionics mechanics, technicians and inspectors  (See 22313 Aircraft instrument, electrical and avionics mechanics, technicians and inspectors)",Exclusion(s),"Mécaniciens/mécaniciennes, techniciens/techniciennes et contrôleurs/contrôleuses d'avionique et d'instruments et d'appareillages électriques d'aéronefs  (Voir 22313 Mécaniciens/mécaniciennes, techniciens/techniciennes et contrôleurs/contrôleuses d'avionique et d'instruments et d'appareillages électriques d'aéronefs)"
22310,Exclusion(s),Electronic service technicians (household and business equipment)  (See 22311 Electronic service technicians (household and business equipment)),Exclusion(s),Électroniciens/électroniciennes d'entretien (biens domestiques et commerciaux)  (Voir 22311 Électroniciens/électroniciennes d'entretien (biens domestiques et commerciaux))
22310,Exclusion(s),Engineering managers  (See 20010 Engineering managers),Exclusion(s),Directeurs/directrices de la fabrication  (Voir 90010 Directeurs/directrices de la fabrication)
22310,Exclusion(s),Industrial instrument technicians and mechanics  (See 22312 Industrial instrument technicians and mechanics),Exclusion(s),Techniciens/techniciennes et mécaniciens/mécaniciennes d'instruments industriels  (Voir 22312 Techniciens/techniciennes et mécaniciens/mécaniciennes d'instruments industriels)
22310,Exclusion(s),Manufacturing managers  (See 90010 Manufacturing managers),Exclusion(s),Directeurs/directrices des services de génie  (Voir 20010 Directeurs/directrices des services de génie)
22310,Exclusion(s),Technical sales specialists - wholesale trade  (See 62100 Technical sales specialists - wholesale trade),Exclusion(s),Spécialistes des ventes techniques - commerce de gros  (Voir 62100 Spécialistes des ventes techniques - commerce de gros)
22311,Exclusion(s),Electrical and electronics engineering technologists and technicians  (See 22310 Electrical and electronics engineering technologists and technicians),Exclusion(s),Technologues et techniciens/techniciennes en génie électrique et électronique  (Voir 22310 Technologues et techniciens/techniciennes en génie électrique et électronique)
22311,Exclusion(s),Telecommunications equipment installation and cable television service technicians  (See 72205 Telecommunications equipment installation and cable television service technicians),Exclusion(s),Techniciens/techniciennes en installation de matériel de télécommunication et en services de câblodistribution  (Voir 72205 Techniciens/techniciennes en installation de matériel de télécommunication et en services de câblodistribution)
22312,Exclusion(s),"Aircraft instrument technician  (See 22313 Aircraft instrument, electrical and avionics mechanics, technicians and inspectors)",Exclusion(s),"Technicien/technicienne d'instruments d'aéronef  (Voir 22313 Mécaniciens/mécaniciennes, techniciens/techniciennes et contrôleurs/contrôleuses d'avionique et d'instruments et d'appareillages électriques d'aéronefs)"
22312,Exclusion(s),Electrical and electronics engineering technologists and technicians  (See 22310 Electrical and electronics engineering technologists and technicians),Exclusion(s),Technologues et techniciens/techniciennes en génie électrique et électronique  (Voir 22310 Technologues et techniciens/techniciennes en génie électrique et électronique)
22312,Exclusion(s),Industrial mechanic  (See 72400 Construction millwrights and industrial mechanics),Exclusion(s),Mécanicien industriel/mécanicienne industrielle  (Voir 72400 Mécaniciens/mécaniciennes de chantier et mécaniciens industriels/mécaniciennes industrielles)
22312,Exclusion(s),Measurement technician - oil and gas inspection  (See 22231 Engineering inspectors and regulatory officers),Exclusion(s),Technicien/technicienne en mesure - inspection d'exploitation pétrolière et gazière  (Voir 22231 Inspecteurs/inspectrices d'ingénierie et officiers/officières de réglementation)
22313,Exclusion(s),Aircraft assemblers and aircraft assembly inspectors  (See 93200 Aircraft assemblers and aircraft assembly inspectors),Exclusion(s),Monteurs/monteuses d'aéronefs et contrôleurs/contrôleuses de montage d'aéronefs  (Voir 93200 Monteurs/monteuses d'aéronefs et contrôleurs/contrôleuses de montage d'aéronefs)
22313,Exclusion(s),Aircraft mechanics and aircraft inspectors  (See 72404 Aircraft mechanics and aircraft inspectors),Exclusion(s),Mécaniciens/mécaniciennes et contrôleurs/contrôleuses d'aéronefs  (Voir 72404 Mécaniciens/mécaniciennes et contrôleurs/contrôleuses d'aéronefs)
22313,Exclusion(s),Airworthiness inspector  (See 22231 Engineering inspectors and regulatory officers),Exclusion(s),Inspecteur/inspectrice de la navigabilité aérienne  (Voir 22231 Inspecteurs/inspectrices d'ingénierie et officiers/officières de réglementation)
22313,Exclusion(s),Electrical mechanics  (See 72422 Electrical mechanics),Exclusion(s),Électromécaniciens/électromécaniciennes  (Voir 72422 Électromécaniciens/électromécaniciennes)
22313,Exclusion(s),Industrial instrument technicians and mechanics  (See 22312 Industrial instrument technicians and mechanics),Exclusion(s),Techniciens/techniciennes et mécaniciens/mécaniciennes d'instruments industriels  (Voir 22312 Techniciens/techniciennes et mécaniciens/mécaniciennes d'instruments industriels)
30010,Exclusion(s),Government managers - health and social policy development and program administration  (See 40010 Government managers - health and social policy development and program administration),Exclusion(s),Gestionnaires de la fonction publique - élaboration de politiques et administration de programmes sociaux et de santé  (Voir 40010 Gestionnaires de la fonction publique - élaboration de politiques et administration de programmes sociaux et de santé)
30010,Exclusion(s),"Senior managers - health, education, social and community services and membership organizations  (See 00013 Senior managers - health, education, social and community services and membership organizations)",Exclusion(s),"Cadres supérieurs/cadres supérieures - santé, enseignement, services sociaux et communautaires et associations mutuelles  (Voir 00013 Cadres supérieurs/cadres supérieures - santé, enseignement, services sociaux et communautaires et associations mutuelles)"
31100,Exclusion(s),Chiropractors  (See 31201 Chiropractors),Exclusion(s),Chiropraticiens/chiropraticiennes  (Voir 31201 Chiropraticiens/chiropraticiennes)
31100,Exclusion(s),Dental surgeon  (See 31110 Dentists),Exclusion(s),Chirurgien/chirurgienne dentiste  (Voir 31110 Dentistes)
31100,Exclusion(s),General practitioners and family physicians  (See 31102 General practitioners and family physicians),Exclusion(s),Omnipraticiens/omnipraticiennes et médecins en médecine familiale  (Voir 31102 Omnipraticiens/omnipraticiennes et médecins en médecine familiale)
31100,Exclusion(s),Immunologist  (See 21110 Biologists and related scientists),Exclusion(s),Immunologiste  (Voir 21110 Biologistes et personnel scientifique assimilé)
31100,Exclusion(s),Managers in health care  (See 30010 Managers in health care),Exclusion(s),Directeurs/directrices des soins de santé  (Voir 30010 Directeurs/directrices des soins de santé)
31100,Exclusion(s),Other professional occupations in health diagnosing and treating  (See 31209 Other professional occupations in health diagnosing and treating),Exclusion(s),Autres professionnels/professionnelles en diagnostic et en traitement de la santé  (Voir 31209 Autres professionnels/professionnelles en diagnostic et en traitement de la santé)
