noc_code,type_english,name_english,type_french,name_french
51120,Exclusion(s),"Technical occupations in motion pictures, broadcasting and the performing arts  (See 5211 Technical occupations in motion pictures, broadcasting and the performing arts)",Exclusion(s),"Personnel technique du cinéma, de la radiotélédiffusion et des arts de la scène  (Voir 5211 Personnel technique du cinéma, de la radiotélédiffusion et des arts de la scène)"
51121,Exclusion(s),Musicians and singers  (See 51122 Musicians and singers),Exclusion(s),Musiciens/musiciennes et chanteurs/chanteuses  (Voir 51122 Musiciens/musiciennes et chanteurs/chanteuses)
51121,Exclusion(s),"Producers, directors, choreographers and related occupations  (See 51120 Producers, directors, choreographers and related occupations)",Exclusion(s),"Producteurs/productrices, réalisateurs/réalisatrices, chorégraphes et personnel assimilé  (Voir 51120 Producteurs/productrices, réalisateurs/réalisatrices, chorégraphes et personnel assimilé)"
51122,Exclusion(s),"Conductors, composers and arrangers  (See 51121 Conductors, composers and arrangers)",Exclusion(s),"Chefs d'orchestre, compositeurs/compositrices et arrangeurs/arrangeuses  (Voir 51121 Chefs d'orchestre, compositeurs/compositrices et arrangeurs/arrangeuses)"
51122,Exclusion(s),Music professor - university  (See 41200 University professors and lecturers),Exclusion(s),Professeur/professeure de musique au niveau universitaire  (Voir 41200 Professeurs/professeures et chargés/chargées de cours au niveau universitaire)
51122,Exclusion(s),Music teacher - elementary school  (See 41221 Elementary school and kindergarten teachers),Exclusion(s),Professeur/professeure de musique au niveau secondaire  (Voir 41220 Enseignants/enseignantes au niveau secondaire)
51122,Exclusion(s),Music teacher - secondary school  (See 41220 Secondary school teachers),Exclusion(s),Professeur/professeure de musique au niveau primaire  (Voir 41221 Enseignants/enseignantes aux niveaux primaire et préscolaire)
52100,Exclusion(s),Archivists  (See 51102 Archivists),Exclusion(s),Archivistes  (Voir 51102 Archivistes)
52100,Exclusion(s),Librarians  (See 51100 Librarians),Exclusion(s),Bibliothécaires  (Voir 51100 Bibliothécaires)
52100,Exclusion(s),Library assistants and clerks  (See 14300 Library assistants and clerks),Exclusion(s),Commis et assistants/assistantes dans les bibliothèques  (Voir 14300 Commis et assistants/assistantes dans les bibliothèques)
52100,Exclusion(s),Records management technicians  (See 12112 Records management technicians),Exclusion(s),Techniciens/techniciennes à la gestion des documents  (Voir 12112 Techniciens/techniciennes à la gestion des documents)
52110,Exclusion(s),Audio and video recording technicians  (See 52113 Audio and video recording technicians),Exclusion(s),Techniciens/techniciennes en enregistrement audio et vidéo  (Voir 52113 Techniciens/techniciennes en enregistrement audio et vidéo)
52110,Exclusion(s),"Audiovisual (AV) assistant  (See 53111 Motion pictures, broadcasting, photography and performing arts assistants and operators)",Exclusion(s),"Assistant/assistante en audiovisuel  (Voir 53111 Assistants/assistantes et opérateurs/opératrices du domaine du cinéma, de la radiotélédiffusion, de la photographie et des arts de la scène)"
52110,Exclusion(s),"Director of photography  (See 51120 Producers, directors, choreographers and related occupations)",Exclusion(s),"Cinéaste  (Voir 51120 Producteurs/productrices, réalisateurs/réalisatrices, chorégraphes et personnel assimilé)"
52110,Exclusion(s),"Filmmaker  (See 51120 Producers, directors, choreographers and related occupations)",Exclusion(s),"Chef opérateur/chef opératrice de prises de vue  (Voir 51120 Producteurs/productrices, réalisateurs/réalisatrices, chorégraphes et personnel assimilé)"
52110,Exclusion(s),Photographers  (See 53110 Photographers),Exclusion(s),Photographes  (Voir 53110 Photographes)
52110,Exclusion(s),"Video artist  (See 53122 Painters, sculptors and other visual artists)",Exclusion(s),"Artiste vidéo  (Voir 53122 Peintres, sculpteurs/sculpteures et autres artistes des arts visuels)"
52110,Exclusion(s),Video transmission operator  (See 52112 Broadcast technicians),Exclusion(s),Opérateur/opératrice à la transmission vidéo  (Voir 52112 Techniciens/techniciennes en radiotélédiffusion)
52111,Exclusion(s),"Camera, platemaking and other prepress occupations  (See 94151 Camera, platemaking and other prepress occupations)",Exclusion(s),"Photograveurs-clicheurs/photograveuses-clicheuses, photograveurs-reporteurs/photograveuses-reporteuses et autre personnel de prépresse  (Voir 94151 Photograveurs-clicheurs/photograveuses-clicheuses, photograveurs-reporteurs/photograveuses-reporteuses et autre personnel de prépresse)"
52111,Exclusion(s),"Correspondence, publication and regulatory clerks  (See 14301 Correspondence, publication and regulatory clerks)",Exclusion(s),Correspondanciers/correspondancières et commis aux publications et aux règlements  (Voir 14301 Correspondanciers/correspondancières et commis aux publications et aux règlements)
52111,Exclusion(s),Desktop publishing (DTP) specialist  (See 14112 Desktop publishing operators and related occupations),Exclusion(s),Spécialiste de l'éditique  (Voir 14112 Opérateurs/opératrices d'équipement d'éditique et personnel assimilé)
52111,Exclusion(s),Graphic designers and illustrators  (See 52120 Graphic designers and illustrators),Exclusion(s),Designers graphiques et illustrateurs/illustratrices  (Voir 52120 Designers graphiques et illustrateurs/illustratrices)
52112,Exclusion(s),Audio and video recording technicians  (See 52113 Audio and video recording technicians),Exclusion(s),Techniciens/techniciennes en enregistrement audio et vidéo  (Voir 52113 Techniciens/techniciennes en enregistrement audio et vidéo)
52112,Exclusion(s),Film and video camera operators  (See 52110 Film and video camera operators),Exclusion(s),Cadreurs/cadreuses de films et cadreurs/cadreuses vidéo  (Voir 52110 Cadreurs/cadreuses de films et cadreurs/cadreuses vidéo)
52112,Exclusion(s),"Other technical and coordinating occupations in motion pictures, broadcasting and the performing arts  (See 52119 Other technical and coordinating occupations in motion pictures, broadcasting and the performing arts)",Exclusion(s),"Autre personnel technique et personnel de coordination du cinéma, de la radiotélédiffusion et des arts de la scène  (Voir 52119 Autre personnel technique et personnel de coordination du cinéma, de la radiotélédiffusion et des arts de la scène)"
52113,Exclusion(s),Broadcast technicians  (See 52112 Broadcast technicians),Exclusion(s),Techniciens/techniciennes en radiotélédiffusion  (Voir 52112 Techniciens/techniciennes en radiotélédiffusion)
52113,Exclusion(s),Film and video camera operators  (See 52110 Film and video camera operators),Exclusion(s),Cadreurs/cadreuses de films et cadreurs/cadreuses vidéo  (Voir 52110 Cadreurs/cadreuses de films et cadreurs/cadreuses vidéo)
52113,Exclusion(s),"Film editor  (See 51120 Producers, directors, choreographers and related occupations)",Exclusion(s),"Monteur/monteuse de films  (Voir 51120 Producteurs/productrices, réalisateurs/réalisatrices, chorégraphes et personnel assimilé)"
52113,Exclusion(s),"Other technical and coordinating occupations in motion pictures, broadcasting and the performing arts  (See 52119 Other technical and coordinating occupations in motion pictures, broadcasting and the performing arts)",Exclusion(s),"Autre personnel technique et personnel de coordination du cinéma, de la radiotélédiffusion et des arts de la scène  (Voir 52119 Autre personnel technique et personnel de coordination du cinéma, de la radiotélédiffusion et des arts de la scène)"
52113,Exclusion(s),"Recording assistant - recording studio  (See 53111 Motion pictures, broadcasting, photography and performing arts assistants and operators)",Exclusion(s),"Assistant/assistante à l'enregistrement - studio d'enregistrement  (Voir 53111 Assistants/assistantes et opérateurs/opératrices du domaine du cinéma, de la radiotélédiffusion, de la photographie et des arts de la scène)"
52114,Exclusion(s),Broadcast journalist  (See 51113 Journalists),Exclusion(s),Journaliste en radiotélédiffusion  (Voir 51113 Journalistes)
52114,Exclusion(s),"Motion pictures, broadcasting, photography and performing arts assistants and operators  (See 53111 Motion pictures, broadcasting, photography and performing arts assistants and operators)",Exclusion(s),"Assistants/assistantes et opérateurs/opératrices du domaine du cinéma, de la radiotélédiffusion, de la photographie et des arts de la scène  (Voir 53111 Assistants/assistantes et opérateurs/opératrices du domaine du cinéma, de la radiotélédiffusion, de la photographie et des arts de la scène)"
52119,Exclusion(s),Audio and video recording technicians  (See 52113 Audio and video recording technicians),Exclusion(s),Techniciens/techniciennes en enregistrement audio et vidéo  (Voir 52113 Techniciens/techniciennes en enregistrement audio et vidéo)
52119,Exclusion(s),Broadcast technicians  (See 52112 Broadcast technicians),Exclusion(s),Techniciens/techniciennes en radiotélédiffusion  (Voir 52112 Techniciens/techniciennes en radiotélédiffusion)
52119,Exclusion(s),Film and video camera operators  (See 52110 Film and video camera operators),Exclusion(s),Cadreurs/cadreuses de films et cadreurs/cadreuses vidéo  (Voir 52110 Cadreurs/cadreuses de films et cadreurs/cadreuses vidéo)
52119,Exclusion(s),"Lighting designer  (See 53123 Theatre, fashion, exhibit and other creative designers)",Exclusion(s),"Concepteur/conceptrice d'éclairage  (Voir 53123 Ensembliers/ensemblières de théâtre, dessinateurs/dessinatrices de mode, concepteurs/conceptrices d'expositions et autres concepteurs/conceptrices artistiques)"
52119,Exclusion(s),"Motion pictures, broadcasting, photography and performing arts assistants and operators  (See 53111 Motion pictures, broadcasting, photography and performing arts assistants and operators)",Exclusion(s),"Assistants/assistantes et opérateurs/opératrices du domaine du cinéma, de la radiotélédiffusion, de la photographie et des arts de la scène  (Voir 53111 Assistants/assistantes et opérateurs/opératrices du domaine du cinéma, de la radiotélédiffusion, de la photographie et des arts de la scène)"
52120,Exclusion(s),"Advertising manager  (See 10022 Advertising, marketing and public relations managers)",Exclusion(s),"Directeur/directrice de la publicité  (Voir 10022 Directeurs/directrices de la publicité, du marketing et des relations publiques)"
52120,Exclusion(s),Graphic arts technicians  (See 52111 Graphic arts technicians),Exclusion(s),Techniciens/techniciennes en graphisme  (Voir 52111 Techniciens/techniciennes en graphisme)
52120,Exclusion(s),Interior designers and interior decorators  (See 52121 Interior designers and interior decorators),Exclusion(s),Designers d'intérieur et décorateurs/décoratrices d'intérieur  (Voir 52121 Designers d'intérieur et décorateurs/décoratrices d'intérieur)
52120,Exclusion(s),"Painters, sculptors and other visual artists  (See 53122 Painters, sculptors and other visual artists)",Exclusion(s),"Peintres, sculpteurs/sculpteures et autres artistes des arts visuels  (Voir 53122 Peintres, sculpteurs/sculpteures et autres artistes des arts visuels)"
52121,Exclusion(s),Graphic designers and illustrators  (See 52120 Graphic designers and illustrators),Exclusion(s),Designers graphiques et illustrateurs/illustratrices  (Voir 52120 Designers graphiques et illustrateurs/illustratrices)
52121,Exclusion(s),Industrial designers  (See 22211 Industrial designers),Exclusion(s),Designers industriels/designers industrielles  (Voir 22211 Designers industriels/designers industrielles)
52121,Exclusion(s),Painters and decorators (except interior decorators)  (See 73112 Painters and decorators (except interior decorators)),Exclusion(s),Peintres et décorateurs/décoratrices (sauf décorateurs/décoratrices d'intérieur)  (Voir 73112 Peintres et décorateurs/décoratrices (sauf décorateurs/décoratrices d'intérieur))
52121,Exclusion(s),"Theatre, fashion, exhibit and other creative designers  (See 53123 Theatre, fashion, exhibit and other creative designers)",Exclusion(s),"Ensembliers/ensemblières de théâtre, dessinateurs/dessinatrices de mode, concepteurs/conceptrices d'expositions et autres concepteurs/conceptrices artistiques  (Voir 53123 Ensembliers/ensemblières de théâtre, dessinateurs/dessinatrices de mode, concepteurs/conceptrices d'expositions et autres concepteurs/conceptrices artistiques)"
53100,Exclusion(s),Assistant museum curator  (See 51101 Conservators and curators),Exclusion(s),Conservateur adjoint/conservatrice adjointe de musée  (Voir 51101 Restaurateurs/restauratrices et conservateurs/conservatrices)
53100,Exclusion(s),"Museum exhibit designer  (See 53123 Theatre, fashion, exhibit and other creative designers)",Exclusion(s),"Concepteur/conceptrice d'expositions muséologiques  (Voir 53123 Ensembliers/ensemblières de théâtre, dessinateurs/dessinatrices de mode, concepteurs/conceptrices d'expositions et autres concepteurs/conceptrices artistiques)"
53100,Exclusion(s),Tour and travel guides  (See 64320 Tour and travel guides),Exclusion(s),Guides touristiques et guides itinérants/guides itinérantes  (Voir 64320 Guides touristiques et guides itinérants/guides itinérantes)
53110,Exclusion(s),Film and video camera operators  (See 52110 Film and video camera operators),Exclusion(s),Cadreurs/cadreuses de films et cadreurs/cadreuses vidéo  (Voir 52110 Cadreurs/cadreuses de films et cadreurs/cadreuses vidéo)
53111,Exclusion(s),Audio and video recording technicians  (See 52113 Audio and video recording technicians),Exclusion(s),Techniciens/techniciennes en enregistrement audio et vidéo  (Voir 52113 Techniciens/techniciennes en enregistrement audio et vidéo)
53111,Exclusion(s),Broadcast technicians  (See 52112 Broadcast technicians),Exclusion(s),Techniciens/techniciennes en radiotélédiffusion  (Voir 52112 Techniciens/techniciennes en radiotélédiffusion)
53111,Exclusion(s),Film and video camera operators  (See 52110 Film and video camera operators),Exclusion(s),Cadreurs/cadreuses de films et cadreurs/cadreuses vidéo  (Voir 52110 Cadreurs/cadreuses de films et cadreurs/cadreuses vidéo)
53111,Exclusion(s),"Other technical and coordinating occupations in motion pictures, broadcasting and the performing arts  (See 52119 Other technical and coordinating occupations in motion pictures, broadcasting and the performing arts)",Exclusion(s),"Autre personnel technique et personnel de coordination du cinéma, de la radiotélédiffusion et des arts de la scène  (Voir 52119 Autre personnel technique et personnel de coordination du cinéma, de la radiotélédiffusion et des arts de la scène)"
53120,Exclusion(s),"Choreographer  (See 51120 Producers, directors, choreographers and related occupations)",Exclusion(s),"Chorégraphe  (Voir 51120 Producteurs/productrices, réalisateurs/réalisatrices, chorégraphes et personnel assimilé)"
53120,Exclusion(s),Other performers  (See 55109 Other performers),Exclusion(s),Autres artistes de spectacle  (Voir 55109 Autres artistes de spectacle)
53121,Exclusion(s),Announcers and other broadcasters  (See 52114 Announcers and other broadcasters),Exclusion(s),Annonceurs/annonceuses et autres communicateurs/communicatrices  (Voir 52114 Annonceurs/annonceuses et autres communicateurs/communicatrices)
53121,Exclusion(s),Dancers  (See 53120 Dancers),Exclusion(s),Danseurs/danseuses  (Voir 53120 Danseurs/danseuses)
53121,Exclusion(s),Drama professor - university  (See 41200 University professors and lecturers),Exclusion(s),Professeur/professeure d'art dramatique au niveau universitaire  (Voir 41200 Professeurs/professeures et chargés/chargées de cours au niveau universitaire)
53121,Exclusion(s),Musicians and singers  (See 51122 Musicians and singers),Exclusion(s),Musiciens/musiciennes et chanteurs/chanteuses  (Voir 51122 Musiciens/musiciennes et chanteurs/chanteuses)
53121,Exclusion(s),Other performers  (See 55109 Other performers),Exclusion(s),Autres artistes de spectacle  (Voir 55109 Autres artistes de spectacle)
53122,Exclusion(s),Art teacher - elementary school  (See 41221 Elementary school and kindergarten teachers),Exclusion(s),Professeur/professeure d'art au niveau secondaire  (Voir 41220 Enseignants/enseignantes au niveau secondaire)
53122,Exclusion(s),Art teacher - secondary school  (See 41220 Secondary school teachers),Exclusion(s),Professeur/professeure d'art au niveau primaire  (Voir 41221 Enseignants/enseignantes aux niveaux primaire et préscolaire)
53122,Exclusion(s),Artisans and craftspersons  (See 53124 Artisans and craftspersons),Exclusion(s),Artisans/artisanes  (Voir 53124 Artisans/artisanes)
53122,Exclusion(s),Fine arts professor - university  (See 41200 University professors and lecturers),Exclusion(s),Professeur/professeure de beaux-arts au niveau universitaire  (Voir 41200 Professeurs/professeures et chargés/chargées de cours au niveau universitaire)
53122,Exclusion(s),Fine arts teacher - college level  (See 41210 College and other vocational instructors),Exclusion(s),Professeur/professeure de beaux-arts - niveau collégial  (Voir 41210 Enseignants/enseignantes au niveau collégial et autres instructeurs/instructrices en formation professionnelle)
53122,Exclusion(s),Graphic designers and illustrators  (See 52120 Graphic designers and illustrators),Exclusion(s),Designers graphiques et illustrateurs/illustratrices  (Voir 52120 Designers graphiques et illustrateurs/illustratrices)
53123,Exclusion(s),"Diorama maker - museums and art galleries  (See 53100 Registrars, restorers, interpreters and other occupations related to museum and art galleries)",Exclusion(s),"Monteur/monteuse de dioramas - musées et galeries d'art  (Voir 53100 Registraires, restaurateurs/restauratrices, interprètes et autres travailleurs/travailleuses dans les domaines apparentés des musées et des galeries d'art)"
53123,Exclusion(s),Graphic designers and illustrators  (See 52120 Graphic designers and illustrators),Exclusion(s),Designers graphiques et illustrateurs/illustratrices  (Voir 52120 Designers graphiques et illustrateurs/illustratrices)
53123,Exclusion(s),Industrial designers  (See 22211 Industrial designers),Exclusion(s),Designers industriels/designers industrielles  (Voir 22211 Designers industriels/designers industrielles)
53123,Exclusion(s),Interior designers and interior decorators  (See 52121 Interior designers and interior decorators),Exclusion(s),Designers d'intérieur et décorateurs/décoratrices d'intérieur  (Voir 52121 Designers d'intérieur et décorateurs/décoratrices d'intérieur)
53123,Exclusion(s),"Patternmakers - textile, leather and fur products  (See 53125 Patternmakers - textile, leather and fur products)",Exclusion(s),Patronniers/patronnières de produits textiles et d'articles en cuir et en fourrure  (Voir 53125 Patronniers/patronnières de produits textiles et d'articles en cuir et en fourrure)
53123,Exclusion(s),"Tailors, dressmakers, furriers and milliners  (See 64200 Tailors, dressmakers, furriers and milliners)",Exclusion(s),"Tailleurs/tailleuses, couturiers/couturières, fourreurs/fourreuses et modistes  (Voir 64200 Tailleurs/tailleuses, couturiers/couturières, fourreurs/fourreuses et modistes)"
53124,Exclusion(s),Cabinetmakers  (See 72311 Cabinetmakers),Exclusion(s),Ébénistes  (Voir 72311 Ébénistes)
53124,Exclusion(s),"Jewellers, jewellery and watch repairers and related occupations  (See 62202 Jewellers, jewellery and watch repairers and related occupations)",Exclusion(s),"Bijoutiers/bijoutières, réparateurs/réparatrices de bijoux, horlogers-rhabilleurs/horlogères-rhabilleuses et personnel assimilé  (Voir 62202 Bijoutiers/bijoutières, réparateurs/réparatrices de bijoux, horlogers-rhabilleurs/horlogères-rhabilleuses et personnel assimilé)"
53124,Exclusion(s),"Painters, sculptors and other visual artists  (See 53122 Painters, sculptors and other visual artists)",Exclusion(s),"Peintres, sculpteurs/sculpteures et autres artistes des arts visuels  (Voir 53122 Peintres, sculpteurs/sculpteures et autres artistes des arts visuels)"
53124,Exclusion(s),"Weavers, knitters and other fabric making occupations  (See 94131 Weavers, knitters and other fabric making occupations)",Exclusion(s),"Tisseurs/tisseuses, tricoteurs/tricoteuses et autres opérateurs/opératrices de machines textiles  (Voir 94131 Tisseurs/tisseuses, tricoteurs/tricoteuses et autres opérateurs/opératrices de machines textiles)"
53125,Exclusion(s),"Supervisors, textile, fabric, fur and leather products processing and manufacturing  (See 92015 Supervisors, textile, fabric, fur and leather products processing and manufacturing)",Exclusion(s),"Surveillants/surveillantes dans la transformation et la fabrication de produits textiles, de tissus, de fourrure et de cuir  (Voir 92015 Surveillants/surveillantes dans la transformation et la fabrication de produits textiles, de tissus, de fourrure et de cuir)"
53200,Exclusion(s),Coaches  (See 53201 Coaches),Exclusion(s),Entraîneurs/entraîneuses  (Voir 53201 Entraîneurs/entraîneuses)
53200,Exclusion(s),"Sports instructor  (See 54100 Program leaders and instructors in recreation, sport and fitness)",Exclusion(s),"Instructeur/instructrice en sport  (Voir 54100 Animateurs/animatrices et responsables de programmes de sports, de loisirs et de conditionnement physique)"
53200,Exclusion(s),Sports officials and referees  (See 53202 Sports officials and referees),Exclusion(s),Arbitres et officiels/officielles de sports  (Voir 53202 Arbitres et officiels/officielles de sports)
53201,Exclusion(s),Athletes  (See 53200 Athletes),Exclusion(s),Athlètes  (Voir 53200 Athlètes)
53201,Exclusion(s),Athletic therapist  (See 31204 Kinesiologists and other professional occupations in therapy and assessment),Exclusion(s),Thérapeute du sport  (Voir 31204 Kinésiologues et autres professionnels/professionnelles en thérapie et en diagnostic)
53201,Exclusion(s),"Program leaders and instructors in recreation, sport and fitness  (See 54100 Program leaders and instructors in recreation, sport and fitness)",Exclusion(s),"Animateurs/animatrices et responsables de programmes de sports, de loisirs et de conditionnement physique  (Voir 54100 Animateurs/animatrices et responsables de programmes de sports, de loisirs et de conditionnement physique)"
53201,Exclusion(s),Sports officials and referees  (See 53202 Sports officials and referees),Exclusion(s),Arbitres et officiels/officielles de sports  (Voir 53202 Arbitres et officiels/officielles de sports)
53202,Exclusion(s),Coaches  (See 53201 Coaches),Exclusion(s),Entraîneurs/entraîneuses  (Voir 53201 Entraîneurs/entraîneuses)
53202,Exclusion(s),"Program leaders and instructors in recreation, sport and fitness  (See 54100 Program leaders and instructors in recreation, sport and fitness)",Exclusion(s),"Animateurs/animatrices et responsables de programmes de sports, de loisirs et de conditionnement physique  (Voir 54100 Animateurs/animatrices et responsables de programmes de sports, de loisirs et de conditionnement physique)"
54100,Exclusion(s),Other instructors  (See 43109 Other instructors),Exclusion(s),Autres instructeurs/instructrices  (Voir 43109 Autres instructeurs/instructrices)
54100,Exclusion(s),"Recreation supervisor  (See 41406 Recreation, sports and fitness policy researchers, consultants and program officers)",Exclusion(s),"Surveillant/surveillante des loisirs  (Voir 41406 Recherchistes, experts-conseils/expertes-conseils et agents/agentes de programme en sports, en loisirs et en conditionnement physique)"
54100,Exclusion(s),"Recreation, sports and fitness program and service directors  (See 50012 Recreation, sports and fitness program and service directors)",Exclusion(s),"Directeurs/directrices de programmes et de services de sports, de loisirs et de conditionnement physique  (Voir 50012 Directeurs/directrices de programmes et de services de sports, de loisirs et de conditionnement physique)"
54100,Exclusion(s),"Sports supervisor  (See 41406 Recreation, sports and fitness policy researchers, consultants and program officers)",Exclusion(s),"Surveillant/surveillante en sport  (Voir 41406 Recherchistes, experts-conseils/expertes-conseils et agents/agentes de programme en sports, en loisirs et en conditionnement physique)"
55109,Exclusion(s),"Actors, comedians and circus performers  (See 53121 Actors, comedians and circus performers)",Exclusion(s),"Acteurs/actrices, comédiens/comédiennes et artistes de cirque  (Voir 53121 Acteurs/actrices, comédiens/comédiennes et artistes de cirque)"
55109,Exclusion(s),Dancers  (See 53120 Dancers),Exclusion(s),Danseurs/danseuses  (Voir 53120 Danseurs/danseuses)
55109,Exclusion(s),Musicians and singers  (See 51122 Musicians and singers),Exclusion(s),Musiciens/musiciennes et chanteurs/chanteuses  (Voir 51122 Musiciens/musiciennes et chanteurs/chanteuses)
60010,Exclusion(s),"Advertising, marketing and public relations managers  (See 10022 Advertising, marketing and public relations managers)",Exclusion(s),"Directeurs/directrices de la publicité, du marketing et des relations publiques  (Voir 10022 Directeurs/directrices de la publicité, du marketing et des relations publiques)"
60010,Exclusion(s),Retail and wholesale trade managers  (See 60020 Retail and wholesale trade managers),Exclusion(s),Directeurs/directrices - commerce de détail et de gros  (Voir 60020 Directeurs/directrices - commerce de détail et de gros)
